commit	profile	wall_time_s	train_total_time_s	startup_overhead_s	train_iter_time_s	train_rays_per_sec	train_batch_load_s	train_feature_cache_load_s	train_feature_gather_s	train_feature_populate_s	train_model_forward_s	train_metrics_loss_s	eval_batch_load_s	eval_feature_cache_load_s	eval_feature_gather_s	eval_feature_populate_s	eval_image_s	eval_all_images_s	peak_gpu_mem_mb	train_psnr	train_feature_error	train_foreground_acc	eval_all_psnr	eval_all_ssim	eval_all_lpips	max_quality_regression_pct	status	description	summary_path
71d189c	measure	684.6573568140157	658.9967651367188	25.660591677296907	0.05673656612634659	144802.359375	0.013376733288168907	0.00041704290197230875	0.0022389658261090517	0.0028114381711930037	0.008864899165928364	0.007254666183143854	0.5740230083465576	0.5625883936882019	0.00115875992923975	0.5638884902000427	70.0772933959961	109.30713653564453	13287.6142578125	32.833335876464844	0.0711783766746521	0.98388671875	24.821815490722656	0.9146652221679688	0.25858786702156067	0.0	keep	baseline measure run	/robodata/smodak/repos/f3rm/benchmark_runs/measure/20260315_181854_measure_71d189c/summary.json
9789320	measure	646.4178457540693	622.7002563476562	23.717589406413026	0.05562983825802803	147755.5	0.013150990009307861	0.0003861459845211357	0.002183791482821107	0.002726465929299593	0.008454888127744198	0.0070892623625695705	0.5969603061676025	0.5856055617332458	0.0012155500007793307	0.5869806408882141	52.15896987915039	107.4054183959961	13287.6142578125	32.86172866821289	0.07168185710906982	0.982421875	24.864870071411133	0.9146259427070618	0.2584609389305115	2.3858215154053437	keep	lazy viewer CLIP imports	/robodata/smodak/repos/f3rm/benchmark_runs/measure/20260315_183438_measure_9789320/summary.json
82a8a77	measure	658.3899561410071	634.2240600585938	24.165896082413383	0.052383434027433395	157110.890625	0.012619515880942345	0.00041918401257134974	0.0022243354469537735	0.0027944897301495075	0.009028451517224312	0.006964097730815411	0.5794883370399475	0.5660668611526489	0.0012910200748592615	0.567527174949646	77.56031799316406	107.33551788330078	13287.6142578125	32.96154022216797	0.07165646553039551	0.9822998046875	24.897083282470703	0.9149852395057678	0.25770047307014465	7.958019706319684	discard	skip steady-state sanitizer scans	/robodata/smodak/repos/f3rm/benchmark_runs/measure/20260315_184617_measure_82a8a77/summary.json
bf6f61a	measure	523.7608370389789	499.552978515625	24.207858523353934	0.054928265511989594	149566.328125	0.012311211787164211	0.000371189002180472	0.002149423584342003	0.0026554374489933252	0.00843676645308733	0.007067608181387186	0.5808168053627014	0.5674697160720825	0.0012640909990295768	0.5689088702201843	3.5188848972320557	25.848552703857422	13287.6142578125	32.891178131103516	0.0716739147901535	0.9837646484375	24.806394577026367	0.9147558212280273	0.258402556180954	4.268573845108933	keep	skip feature rendering during eval	/robodata/smodak/repos/f3rm/benchmark_runs/measure/20260315_185807_measure_bf6f61a/summary.json
c331243	measure	504.224964236957	479.6089172363281	24.616047000628896	0.05313790962100029	154625.859375	0.01125681959092617	0.0003851290384773165	0.0021411555353552103	0.002668865257874131	0.007966074161231518	0.007390611805021763	0.5410873293876648	0.5295178890228271	0.0011485510040074587	0.5308347344398499	3.2175986766815186	25.32963752746582	13287.6142578125	32.85460662841797	0.07178688049316406	0.98388671875	24.826566696166992	0.9146116375923157	0.2581441104412079	8.257719175818693	keep	keep CUDA cache warm during eval	/robodata/smodak/repos/f3rm/benchmark_runs/measure/20260315_190756_measure_c331243/summary.json
cceeb05	measure	575.9937087560538	551.0390014648438	24.95470729121007	0.05567809194326401	147953.453125	0.01253896951675415	0.00039571954403072596	0.0021634320728480816	0.0027145270723849535	0.008781262673437595	0.006825873628258705	0.5837302207946777	0.5699724555015564	0.0013082000659778714	0.5714665055274963	3.2691497802734375	24.63288116455078	13287.6142578125	33.01771545410156	0.07171270251274109	0.9842529296875	25.020875930786133	0.9151456952095032	0.2551042437553406	2.904456659016189	discard	double eval rays per chunk	/robodata/smodak/repos/f3rm/benchmark_runs/measure/20260315_191720_measure_cceeb05/summary.json
81a213b	measure	535.253833121038	510.9189758300781	24.334857290959917	0.05950571224093437	140326.328125	0.01545246783643961	0.0004204580036457628	0.002192040905356407	0.002778824884444475	0.009050054475665092	0.007104453630745411	0.6992014050483704	0.685021162033081	0.0011921810219064355	0.6863804459571838	3.294022798538208	25.302875518798828	13287.6142578125	32.91123580932617	0.07155802845954895	0.9835205078125	24.976276397705078	0.9152076244354248	0.2573902904987335	4.705976009596472	discard	drop eval progress bars	/robodata/smodak/repos/f3rm/benchmark_runs/measure/20260315_192810_measure_81a213b/summary.json
2b5a90a	measure	532.6265625240048	509.4695129394531	23.157049584551714	0.0567018985748291	146841.390625	0.013768009841442108	0.00040685312706045806	0.0021679240744560957	0.0027293385937809944	0.008735974319279194	0.006960252299904823	0.5788384675979614	0.5675838589668274	0.0012059399159625173	0.5689442157745361	3.214329957962036	25.331098556518555	13287.6142578125	32.78355407714844	0.07191140949726105	0.9832763671875	24.68583869934082	0.9145662784576416	0.2579152584075928	5.483223454660048	discard	skip startup cache clearing	/robodata/smodak/repos/f3rm/benchmark_runs/measure/20260315_193755_measure_2b5a90a/summary.json
38cacb7	measure	536.5336166099878	513.4447631835938	23.088853426394053	0.05824984237551689	143052.65625	0.013942467980086803	0.0004074280150234699	0.0021888762712478638	0.002758883172646165	0.009586270898580551	0.006624671630561352	0.7193663120269775	0.7091641426086426	0.001446109963580966	0.710814356803894	3.256098747253418	25.352462768554688	13287.6142578125	32.85680389404297	0.07149295508861542	0.983642578125	24.750017166137695	0.9136683940887451	0.25710123777389526	6.668111263466884	discard	drop per-step current-step scalar	/robodata/smodak/repos/f3rm/benchmark_runs/measure/20260315_194733_measure_38cacb7/summary.json
c314155	measure	8.833050793036819																									crash	cache trainer optimizer metadata	/robodata/smodak/repos/f3rm/benchmark_runs/measure/20260315_195720_measure_c314155/summary.json
7075e21	measure	614.7917931720149	590.1871337890625	24.604659382952377	0.10048700869083405	87412.9375	0.033026233315467834	0.0008930719923228025	0.0029862772207707167	0.004250991158187389	0.022154245525598526	0.0061466284096241	1.2716596126556396	1.2421562671661377	0.0015406899619847536	1.2440872192382812	4.647627830505371	33.27415084838867	13239.6767578125	32.96974563598633	0.07121127843856812	0.9840087890625	24.835893630981445	0.9145662784576416	0.2576521635055542	1.261964038082989	discard	cache per-step loss terms	/robodata/smodak/repos/f3rm/benchmark_runs/measure/20260315_195854_measure_7075e21/summary.json
2c011f4	measure	595.5168209769763	571.9638061523438	23.553014824632555	0.05549563094973564	149851.5	0.013532165437936783	0.000375944102415815	0.0021495346445590258	0.0026646917685866356	0.0078872200101614	0.007399451453238726	0.5597079396247864	0.5436975359916687	0.0014020699309185147	0.5452542304992676	3.2596709728240967	25.250696182250977	13215.6142578125	32.860595703125	0.07152211666107178	0.9832763671875	24.987140655517578	0.9149752259254456	0.25642290711402893	5.522204268317546	discard	fuse feature metrics into loss pass	benchmark_runs/measure/20260315_201452_measure_2c011f4/summary.json
1188b60	measure	540.0237433939474	517.1177368164062	22.90600657754112	0.05311063677072525	154774.515625	0.011053832247853279	0.00036338402424007654	0.0021288790740072727	0.002636453602463007	0.00753042520955205	0.0074960170313715935	0.6574136018753052	0.6432268023490906	0.0011826399713754654	0.6445825695991516	3.2231812477111816	25.142169952392578	13276.39453125	32.866912841796875	0.07152259349822998	0.9827880859375	24.87000274658203	0.9149132370948792	0.25787660479545593	8.698725065657314	discard	skip image-only batch outputs	benchmark_runs/measure/20260315_202659_measure_1188b60/summary.json
33545a8	measure	500.1473574460251	477.47052001953125	22.676837426493876	0.052649736404418945	156080.40625	0.011374621652066708	0.00036085298052057624	0.0021300073713064194	0.0026222229935228825	0.007828818634152412	0.00723911402747035	0.5369275212287903	0.5264226198196411	0.0012662899680435658	0.5278443694114685	3.19767165184021	25.119237899780273	13287.623046875	32.87513732910156	0.07131336629390717	0.9833984375	24.77092933654785	0.9144445061683655	0.2592206299304962	12.001189850697815	discard	use fused Adam plus set_to_none	benchmark_runs/measure/20260315_203828_measure_33545a8/summary.json
8103a3a	measure	515.9685121269431	492.3696594238281	23.59885270311497	0.052948545664548874	155180.546875	0.011330284178256989	0.00036298204213380814	0.0021025394089519978	0.0025942421052604914	0.007924006320536137	0.0071886139921844006	0.6179037094116211	0.6016443371772766	0.001238380093127489	0.6030325889587402	3.215216636657715	25.278961181640625	13287.623046875	32.79962921142578	0.07164634019136429	0.984375	25.086645126342773	0.9152681827545166	0.256005197763443	1.0809851938948818	discard	use fused Adam except camera_opt	benchmark_runs/measure/20260315_204908_measure_8103a3a/summary.json
f2895e6	measure	594.5637690300355	571.9645385742188	22.599230455816723	0.052832186222076416	155519.0	0.011386463418602943	0.0003550053806975484	0.0021267104893922806	0.002610390540212393	0.007620382122695446	0.007518348749727011	0.538889467716217	0.5280810594558716	0.0011976700043305755	0.5294203162193298	3.1943929195404053	25.132841110229492	13287.6142578125	32.969329833984375	0.07163956761360168	0.9835205078125	24.99003791809082	0.9159520864486694	0.25607848167419434	7.179656583880907	discard	skip viewer imports for non-viewer runs (run 1)	benchmark_runs/measure/20260315_211108_measure_f2895e6/summary.json
f2895e6	measure	501.1954850470647	478.34783935546875	22.84764569159597	0.052659668028354645	156089.390625	0.010821372270584106	0.0003661460359580815	0.0021334905177354813	0.0026363006327301264	0.00789722427725792	0.007219177670776844	0.5766400098800659	0.5669138431549072	0.0013585799606516957	0.5684570074081421	3.263671398162842	25.18616485595703	13287.6142578125	33.01569747924805	0.07142980396747589	0.9844970703125	24.979198455810547	0.9157577753067017	0.25603318214416504	8.06506743587563	keep	skip viewer imports for non-viewer runs (run 2)	benchmark_runs/measure/20260315_212136_measure_f2895e6/summary.json
