commit	profile	wall_time_s	train_total_time_s	startup_overhead_s	train_iter_time_s	train_rays_per_sec	train_batch_load_s	train_feature_cache_load_s	train_feature_gather_s	train_feature_populate_s	train_model_forward_s	train_metrics_loss_s	eval_batch_load_s	eval_feature_cache_load_s	eval_feature_gather_s	eval_feature_populate_s	eval_image_s	eval_all_images_s	peak_gpu_mem_mb	train_psnr	train_feature_error	train_foreground_acc	eval_all_psnr	eval_all_ssim	eval_all_lpips	max_quality_regression_pct	status	description	summary_path
324d4ab	measure	490.637921932037	465.3646545410156	25.273267391021363	0.05327840894460678	154656.875	0.010909847915172577	0.00037290409090928733	0.002156802685931325	0.002675411058589816	0.008281994611024857	0.007173788268119097	0.5875999331474304	0.5777639150619507	0.0012228089617565274	0.5791207551956177	3.2345681190490723	25.08363914489746	13287.6142578125	32.924232482910156	0.07148122787475586	0.983642578125	24.945667266845703	0.9154329299926758	0.2563669979572296	0.0	keep	baseline	/robodata/smodak/repos/f3rm/benchmark_runs/measure/20260316_121030_measure_324d4ab/summary.json
324d4ab	measure	475.68084607704077	452.0580139160156	23.622832161025144	0.04971269518136978	165401.546875	0.01137054618448019	0.00037163306842558086	0.0021536925341933966	0.002658461919054389	0.007885254919528961	0.00719096977263689	0.5647732019424438	0.5536681413650513	0.0012190500274300575	0.5550146698951721	3.256288528442383	25.182804107666016	13287.6142578125	33.021888732910156	0.0714150220155716	0.983154296875	24.761619567871094	0.9137580394744873	0.2577439248561859	7.078772449184223	keep	exp1_trainer_sanitize_slow_path	/robodata/smodak/repos/f3rm/benchmark_runs/measure/20260316_122523_measure_324d4ab/summary.json
324d4ab	measure	472.84103762207087	449.33013916015625	23.51089846191462	0.0513935461640358	159939.984375	0.013136068359017372	0.0001174708959297277	0.003003197954967618	0.0041365125216543674	0.007796610239893198	0.0073195830918848515	0.5917661786079407	0.580059826374054	0.0017532599158585072	0.5822799801826477	3.215667247772217	25.16632652282715	13287.6142578125	33.0128059387207	0.07152655720710754	0.98388671875	25.091325759887695	0.9153020977973938	0.2570056617259979	7.208617351135577	discard	exp2_grouped_feature_gather_ambiguous_reject	/robodata/smodak/repos/f3rm/benchmark_runs/measure/20260316_123533_measure_324d4ab/summary.json
324d4ab	measure	462.7163915709825	439.4025573730469	23.31383419793565	0.04835914447903633	170005.90625	0.010361839085817337	0.0003674736653920263	0.0021336351055651903	0.002635297365486622	0.0075095403008162975	0.007589332293719053	0.5552287697792053	0.5452882647514343	0.001361129921860993	0.5468400716781616	3.2487285137176514	25.165531158447266	13287.6142578125	32.83401870727539	0.0714295357465744	0.9825439453125	24.826946258544922	0.9144791960716248	0.2579559087753296	8.540172744059833	keep	exp3_eval_progress_removed	/robodata/smodak/repos/f3rm/benchmark_runs/measure/20260316_124558_measure_324d4ab/summary.json
324d4ab	measure	460.78841279202607	437.4580383300781	23.33037446194794	0.04864630848169327	168993.9375	0.010266372933983803	0.0003689205041155219	0.0021337775979191065	0.0026344500947743654	0.007870477624237537	0.007287969347089529	0.5463082790374756	0.5366420745849609	0.001135980011895299	0.5379090905189514	3.135538339614868	24.256206512451172	13287.6142578125	32.829586029052734	0.07153566926717758	0.9833984375	24.62377166748047	0.9135605096817017	0.259284108877182	6.969294654511902	keep	exp4_eval_chunk_65536	/robodata/smodak/repos/f3rm/benchmark_runs/measure/20260316_125554_measure_324d4ab/summary.json
324d4ab	measure	461.96244428807404	439.06158447265625	22.90085981541779	0.0495084747672081	166053.15625	0.011333053931593895	0.000362356542609632	0.0021307740826159716	0.0026255554985255003	0.007809402421116829	0.007227474357932806	0.5904873609542847	0.5795732736587524	0.0012289599981158972	0.5809524655342102	3.1257872581481934	24.160343170166016	13287.6142578125	32.918190002441406	0.07186038792133331	0.98388671875	24.512622833251953	0.9164021015167236	0.2534150183200836	7.597756354862079	discard	exp5_local_writer_disabled_reject	/robodata/smodak/repos/f3rm/benchmark_runs/measure/20260316_130429_measure_324d4ab/summary.json
324d4ab	measure	430.2074842109578	406.8831787109375	23.324305500020273	0.04739818722009659	173287.015625	0.012348122894763947	0.00036099948920309544	0.002115315990522504	0.0026078675873577595	0.006766133941709995	0.007297298405319452	0.6016859412193298	0.5908312797546387	0.0012147900415584445	0.592190682888031	3.1334497928619385	24.23946189880371	13218.71484375	32.462318420410156	0.07155971229076385	0.9835205078125	25.658721923828125	0.9253048300743103	0.2519446611404419	4.052198414461935	keep	exp6_camera_optimizer_off	/robodata/smodak/repos/f3rm/benchmark_runs/measure/20260316_131252_measure_324d4ab/summary.json
324d4ab	measure	396.50243774603587	373.15826416015625	23.344173585879616	0.0421571247279644	195054.53125	0.010292147286236286	0.0003630804712884128	0.002128337509930134	0.002628123154863715	0.005968209821730852	0.006046866532415152	0.5852314233779907	0.5756054520606995	0.001165800029411912	0.5769197940826416	1.9005528688430786	12.766343116760254	12985.2587890625	32.414527893066406	0.07137437909841537	0.9832763671875	25.796154022216797	0.9263226985931396	0.2479771077632904	3.582653927862233	keep	exp7_predict_normals_off	/robodata/smodak/repos/f3rm/benchmark_runs/measure/20260316_132121_measure_324d4ab/summary.json
324d4ab	measure	370.82699040102307	347.6494445800781	23.177545820944943	0.04291318729519844	191542.140625	0.011110672727227211	0.0003624730452429503	0.00212861062027514	0.0026125656440854073	0.005718044470995665	0.006076059769839048	0.5313577651977539	0.5207085013389587	0.001195330056361854	0.5220502614974976	1.8539435863494873	12.742019653320312	12985.2587890625	32.33368682861328	0.07111604511737823	0.98388671875	25.467084884643555	0.9255495071411133	0.2509381175041199	5.71913416894731	keep	exp8_timing_write_throttled	/robodata/smodak/repos/f3rm/benchmark_runs/measure/20260316_133015_measure_324d4ab/summary.json
324d4ab	measure	389.7110396339558	362.0662841796875	27.644755454268306	0.06943921744823456	119311.9296875	0.03235061839222908	0.0005709710530936718	0.0024816603399813175	0.003271135501563549	0.009486572816967964	0.005703980568796396	1.365188717842102	1.3309218883514404	0.0015488199423998594	1.3327409029006958	1.9917833805084229	13.564640998840332	12913.2587890625	32.47490310668945	0.07154795527458191	0.9832763671875	25.63988494873047	0.926622748374939	0.2500959038734436	2.921303203861922	discard	exp9_model_supervision_cache_reject	/robodata/smodak/repos/f3rm/benchmark_runs/measure/20260316_133936_measure_324d4ab/summary.json
324d4ab	measure	371.56292133405805	348.1020812988281	23.46084003522992	0.042763471603393555	192252.90625	0.01113794930279255	0.00035644450690597296	0.0021189874969422817	0.002598721068352461	0.005452391225844622	0.006170948036015034	0.5403782725334167	0.5290971398353577	0.0011341599747538567	0.5303638577461243	1.8948231935501099	12.703804969787598	12980.7587890625	32.4775505065918	0.07151810824871063	0.9862060546875	25.67664337158203	0.9262205362319946	0.2503407597541809	1.3566967021940959	discard	exp10_shared_feature_positions_reject	/robodata/smodak/repos/f3rm/benchmark_runs/measure/20260316_134843_measure_324d4ab/summary.json
324d4ab	measure	350.81183499493636	327.7092590332031	23.102575961733237	0.04021782800555229	204110.890625	0.011170773766934872	0.0003624926321208477	0.0021199211478233337	0.002600973006337881	0.004255298059433699	0.006148097105324268	0.5510827898979187	0.5403984785079956	0.001214300049468875	0.5417916178703308	1.7862462997436523	11.449921607971191	12864.921875	32.250343322753906	0.07078087329864502	0.9869384765625	25.736005783081055	0.9241742491722107	0.2605106830596924	14.896228401300293	keep	exp11_num_proposal_iterations_1	/robodata/smodak/repos/f3rm/benchmark_runs/measure/20260316_140013_measure_324d4ab/summary.json
324d4ab	measure	348.280294638942	325.4208984375	22.859396201441996	0.04207427427172661	195077.8125	0.013045222498476505	0.00035278810537420213	0.00212594261392951	0.0025946551468223333	0.004232355393469334	0.006136867217719555	0.5375880002975464	0.5269968509674072	0.0011693709529936314	0.5283382534980774	1.7907588481903076	11.307405471801758	12864.921875	32.142765045166016	0.07055020332336426	0.98681640625	25.77373504638672	0.924368679523468	0.26191291213035583	15.052376375608295	discard	exp12_eval_chunk_131072_reject	/robodata/smodak/repos/f3rm/benchmark_runs/measure/20260316_140909_measure_324d4ab/summary.json
324d4ab	measure	376.3204659849871	352.25396728515625	24.066498699830845	0.04998035356402397	170998.359375	0.01734638400375843	0.0004599929670803249	0.0022610758896917105	0.0028966451063752174	0.006374473683536053	0.005941573530435562	0.797622799873352	0.7623742818832397	0.001261320081539452	0.7639076709747314	2.0101113319396973	12.318562507629395	12864.921875	32.239498138427734	0.0708642452955246	0.988525390625	25.435728073120117	0.92378830909729	0.2613585591316223	13.970698372585488	discard	exp13_current_step_removed_reject	/robodata/smodak/repos/f3rm/benchmark_runs/measure/20260316_141556_measure_324d4ab/summary.json
324d4ab	measure	348.04797589196824	324.5050048828125	23.542971009155735	0.03984947130084038	206050.796875	0.010192522779107094	0.00035433744778856635	0.00213664211332798	0.0026149405166506767	0.00441094720736146	0.006109173409640789	0.5306909680366516	0.5210158824920654	0.001137040089815855	0.5223054885864258	1.8922762870788574	11.479462623596191	12864.921875	32.21085739135742	0.07075104862451553	0.9874267578125	25.403820037841797	0.9236869812011719	0.25930625200271606	14.537598721937414	keep	exp14_writer_put_time_throttled	/robodata/smodak/repos/f3rm/benchmark_runs/measure/20260316_142617_measure_324d4ab/summary.json
324d4ab	measure	348.0775640429929	325.3671569824219	22.710407060571015	0.0392894521355629	208973.078125	0.009975514374673367	0.00034510588739067316	0.0021234280429780483	0.002589842537418008	0.004232198465615511	0.006111385766416788	0.5496921539306641	0.5397990942001343	0.0011505699949339032	0.5410854816436768	1.7805455923080444	11.437735557556152	12792.921875	32.213722229003906	0.07081581652164459	0.988525390625	25.50535774230957	0.923144519329071	0.2601543664932251	14.89369710484619	discard	exp15_metrics_loss_dedupe_neutral_reject	/robodata/smodak/repos/f3rm/benchmark_runs/measure/20260316_143408_measure_324d4ab/summary.json
324d4ab	measure	16.18346565205138																									discard	exp16_foreground_num_layers_1_invalid_tcnn	/robodata/smodak/repos/f3rm/benchmark_runs/measure/20260316_144053_measure_324d4ab/summary.json
324d4ab	measure	375.93121918290854	348.9879150390625	26.943304143846035	0.04017205163836479	204385.890625	0.0105489082634449	0.000346034939866513	0.0021262397058308125	0.002595864934846759	0.004473232198506594	0.006074258591979742	0.599463939666748	0.5863596200942993	0.0011474000057205558	0.5876541137695312	1.7930063009262085	11.446257591247559	12864.853515625	32.20573043823242	0.07071807235479355	0.9866943359375	25.7228946685791	0.9243395328521729	0.25986239314079285	17.403917764561474	discard	exp17_foreground_hidden_dim_32_reject	/robodata/smodak/repos/f3rm/benchmark_runs/measure/20260316_144146_measure_324d4ab/summary.json
324d4ab	measure	335.58435214101337	311.5477294921875	24.03662264882587	0.03846548870205879	213457.125	0.010989726521074772	0.0003516654542181641	0.002110063098371029	0.0025840916205197573	0.0041091302409768105	0.0053348299115896225	0.6123316884040833	0.601753830909729	0.0012216500472277403	0.6031489372253418	1.6204687356948853	10.151185035705566	12702.83984375	32.101531982421875	0.07025352120399475	0.986328125	25.727428436279297	0.9244563579559326	0.2601301074028015	15.163137103930522	discard	exp18_feat_use_pe_off_near_miss	/robodata/smodak/repos/f3rm/benchmark_runs/measure/20260316_145049_measure_324d4ab/summary.json
324d4ab	measure	334.38957267603837	310.5082702636719	23.881302412366495	0.03862113878130913	212583.640625	0.01127625908702612	0.0003466105554252863	0.0021065985783934593	0.0025702910497784615	0.004017691593617201	0.0053236838430166245	0.5497187972068787	0.5389837026596069	0.0012864799937233329	0.5404841899871826	1.7091138362884521	10.14521598815918	12702.83984375	32.110076904296875	0.07156717777252197	0.9822998046875	25.32569694519043	0.9229822158813477	0.2633841037750244	2.7371330450908826	keep	exp19_feat_use_pe_off_distortion_0p0025	/robodata/smodak/repos/f3rm/benchmark_runs/measure/20260316_145756_measure_324d4ab/summary.json
324d4ab	measure	336.62736047198996	313.09051513671875	23.53684533527121	0.03780829906463623	217202.609375	0.010064846836030483	0.0003423590096645057	0.0021056621335446835	0.002566264709457755	0.004091694951057434	0.005312665365636349	0.5498342514038086	0.5401137471199036	0.0011385699035599828	0.5413869023323059	1.6530251502990723	10.15554428100586	12702.6552734375	32.09628677368164	0.07268179208040237	0.984375	25.22522735595703	0.9229821562767029	0.2625635266304016	4.045046080241513	discard	exp20_feat_hidden_dim_48_wall_regression	/robodata/smodak/repos/f3rm/benchmark_runs/measure/20260316_150441_measure_324d4ab/summary.json
324d4ab	measure	318.6769495269982	294.55560302734375	24.121346499654464	0.03601086139678955	228141.765625	0.011128521524369717	0.00034545944072306156	0.0021191928535699844	0.002587065100669861	0.0040646204724907875	0.004446772392839193	0.5576754212379456	0.5468966364860535	0.0011504699941724539	0.5482036471366882	1.594377875328064	9.296642303466797	12167.02734375	31.829200744628906	0.07191183418035507	0.982666015625	25.18535804748535	0.9215684533119202	0.26189514994621277	3.325914245228476	keep	exp24_num_nerf_samples_40_keep	/robodata/smodak/repos/f3rm/benchmark_runs/measure/20260316_151537_measure_324d4ab/summary.json
324d4ab	measure	296.3567836820148	272.5968322753906	23.759951406624168	0.03279905393719673	250521.78125	0.010741864331066608	0.0003404229646548629	0.0021070728544145823	0.002566742245107889	0.004080004058778286	0.00354377506300807	0.575974702835083	0.563839852809906	0.001152440090663731	0.5651298761367798	1.5160589218139648	8.418511390686035	11631.21484375	31.780582427978516	0.07298408448696136	0.9840087890625	24.910438537597656	0.9191501140594482	0.2653427720069885	3.5011425500470863	keep	exp28_num_nerf_samples_32_keep	/robodata/smodak/repos/f3rm/benchmark_runs/measure/20260316_152503_measure_324d4ab/summary.json
324d4ab	measure	283.5600399209652	259.7428283691406	23.817211551824585	0.03053462505340576	269314.84375	0.009962882846593857	0.0003503299376461655	0.002128076506778598	0.0026030249428004026	0.0041646030731499195	0.003105836920440197	0.5468794107437134	0.5374082922935486	0.0012191099813207984	0.5387725830078125	1.5002717971801758	7.908315181732178	11363.30859375	31.76587677001953	0.07407055050134659	0.982421875	24.74384117126465	0.9166112542152405	0.26954385638237	6.511532616074005	keep	exp30_num_nerf_samples_28_keep	/robodata/smodak/repos/f3rm/benchmark_runs/measure/20260316_153116_measure_324d4ab/summary.json
324d4ab	measure	271.1257614499191	248.94583129882812	22.179930151090957	0.030247271060943604	272611.4375	0.012467111460864544	0.0003500940802041441	0.002133105183020234	0.0026006526313722134	0.004301231820136309	0.002390090608969331	0.5939395427703857	0.5809240341186523	0.0012777900556102395	0.582342267036438	1.593583583831787	6.9995927810668945	10842.318359375	31.78489875793457	0.07601603120565414	0.98193359375	25.122648239135742	0.9185630679130554	0.26896268129348755	6.34404789302701	keep	exp40_feat_encoding_trim_keep	/robodata/smodak/repos/f3rm/benchmark_runs/measure/20260316_155458_measure_324d4ab/summary.json
324d4ab	measure	314.4226150600007	290.42047119140625	24.00214386859443	0.027196895331144333	226991.296875	0.011407150886952877	0.0002956034441012889	0.0019987914711236954	0.0024043365847319365	0.004229619167745113	0.001961508998647332	0.8309953808784485	0.8163149356842041	0.0017066800501197577	0.8181906342506409	1.454290509223938	8.057262420654297	10306.490234375	31.005491256713867	0.07666359096765518	0.9845377802848816	24.802404403686523	0.9173305630683899	0.2733714282512665	7.249963727511057	discard	exp44_train_num_rays_6144_measure_reject	/robodata/smodak/repos/f3rm/benchmark_runs/measure/20260316_160214_measure_324d4ab/summary.json
324d4ab	measure	233.21550890093204	213.54322814941406	19.672280751517974	0.023999463766813278	343097.15625	0.009974583983421326	0.00033918459666892886	0.002121216617524624	0.0025780436117202044	0.0045721931383013725	0.001562783494591713	0.5399893522262573	0.5217023491859436	0.0011396800400689244	0.5230010747909546	1.3721972703933716	6.976687908172607	10180.994140625	31.861289978027344	0.0803629606962204	0.982666015625	24.939733505249023	0.9177479147911072	0.2687782049179077	12.425266165022315	discard	exp55_shared_encoding_feat_0_5_foreground_0_5_measure_judgment	/robodata/smodak/repos/f3rm/benchmark_runs/measure/20260316_162243_measure_324d4ab/summary.json
324d4ab	measure	245.29555391997565	226.4149932861328	18.880560633842833	0.027174795046448708	303155.09375	0.010917028412222862	0.000336683850036934	0.0021215975284576416	0.00257656117901206	0.0049456097185611725	0.0019767419435083866	0.5170450806617737	0.5064451694488525	0.0011936100199818611	0.5077829957008362	1.3383709192276	6.968099594116211	10315.880859375	31.68568229675293	0.07966997474431992	0.9814453125	24.712247848510742	0.9171756505966187	0.27085909247398376	11.455800512984716	discard	exp56_shared_encoding_feat_0_75_foreground_0_5_measure_judgment	/robodata/smodak/repos/f3rm/benchmark_runs/measure/20260316_162729_measure_324d4ab/summary.json
324d4ab	measure	252.46704176499043	233.73951721191406	18.727524553076364	0.02949817106127739	278880.21875	0.012213394045829773	0.0003419240238144994	0.002119183074682951	0.0025770466309040785	0.0046581607311964035	0.0023758376482874155	0.5530749559402466	0.5425340533256531	0.001210779999382794	0.5438894629478455	1.3724592924118042	6.9550323486328125	10740.990234375	31.634479522705078	0.07986950874328613	0.98193359375	25.011085510253906	0.9174259305000305	0.271150678396225	11.734942330911831	discard	exp57_shared_encoding_feat_full_foreground_0_5_measure_judgment	/robodata/smodak/repos/f3rm/benchmark_runs/measure/20260316_163231_measure_324d4ab/summary.json
324d4ab	measure	239.16253366798628	218.97349548339844	20.189038184587844	0.02566448412835598	321169.28125	0.010853895917534828	0.0003398550907149911	0.00211098650470376	0.002564828610047698	0.00479349959641695	0.001592364627867937	0.525482177734375	0.5149737000465393	0.0011284200008958578	0.5162439346313477	1.3848953247070312	6.950902938842773	10256.916015625	31.870695114135742	0.07698938995599747	0.982177734375	24.98272705078125	0.9181960821151733	0.2695067524909973	7.705746312713882	keep	exp59_no_share_feat_0_5_foreground_0_5_keep	/robodata/smodak/repos/f3rm/benchmark_runs/measure/20260316_163815_measure_324d4ab/summary.json
324d4ab	measure	235.86350862903055	216.21224975585938	19.651258873171173	0.02588251791894436	318423.5	0.010971024632453918	0.0003401360008865595	0.0021063790190964937	0.0025584984105080366	0.00484438193961978	0.0015921220183372498	0.5602282881736755	0.5496100187301636	0.0011944600846618414	0.5509417057037354	1.3745884895324707	6.9444780349731445	10256.916015625	31.673072814941406	0.0769776999950409	0.9814453125	25.00396728515625	0.9180431962013245	0.26929524540901184	7.689392423302448	keep	exp64_foreground_train_ratio_0_25_no_share_measure_keep	/robodata/smodak/repos/f3rm/benchmark_runs/measure/20260316_165302_measure_324d4ab/summary.json
324d4ab	measure	232.88401581102517	213.2853240966797	19.598691714345478	0.025425326079130173	324582.3125	0.011006170883774757	0.00034303206484764814	0.002118671778589487	0.0025796210393309593	0.00483997305855155	0.0014874349581077695	0.5838305354118347	0.5730248093605042	0.00120726996101439	0.5743718147277832	1.2748483419418335	6.598814010620117	10255.166015625	31.48393440246582	0.0786718875169754	0.98095703125	25.01354217529297	0.9175785183906555	0.2700972855091095	10.059507728124771	discard	exp67_num_nerf_samples_24_on_fg_0_25_measure_judgment	/robodata/smodak/repos/f3rm/benchmark_runs/measure/20260316_165841_measure_324d4ab/summary.json
324d4ab	measure	233.97217421291862	213.96463012695312	20.007544085965492	0.024818753823637962	332368.1875	0.010626348666846752	0.0003352569474373013	0.0021044290624558926	0.0025522152427583933	0.0047156233340501785	0.0014831876615062356	0.5926766991615295	0.5821388363838196	0.0012406300520524383	0.5835237503051758	1.3298170566558838	6.717019557952881	10297.068359375	31.788742065429688	0.0783206969499588	0.9814453125	24.794740676879883	0.9165449142456055	0.2699868977069855	9.56820311926728	keep	exp76_num_nerf_24_feat_num_levels_10_measure_keep	/robodata/smodak/repos/f3rm/benchmark_runs/measure/20260316_171829_measure_324d4ab/summary.json
