commit	profile	wall_time_s	train_total_time_s	startup_overhead_s	train_iter_time_s	train_rays_per_sec	train_batch_load_s	train_feature_cache_load_s	train_feature_gather_s	train_feature_populate_s	train_model_forward_s	train_metrics_loss_s	eval_batch_load_s	eval_feature_cache_load_s	eval_feature_gather_s	eval_feature_populate_s	eval_image_s	eval_all_images_s	peak_gpu_mem_mb	train_psnr	train_feature_error	train_foreground_acc	eval_all_psnr	eval_all_ssim	eval_all_lpips	max_quality_regression_pct	status	description	summary_path
324d4ab	measure	238.3877056139754	218.73309326171875	19.654612352256663	0.02582366392016411	319121.6875	0.010758495889604092	0.0003359485708642751	0.0021126833744347095	0.0025647624861449003	0.004694931674748659	0.0018041530856862664	0.6038004755973816	0.5932217836380005	0.0012280199443921447	0.5945962071418762	1.2890626192092896	6.572264194488525	10273.166015625	31.492687225341797	0.0772593691945076	0.97900390625	24.864782333374023	0.9166224002838135	0.2691079080104828	8.08343881539888	discard	exp77_num_nerf_24_feat_train_ratio_0_75_measure_slower	/robodata/smodak/repos/f3rm/benchmark_runs/measure/20260316_172232_measure_324d4ab/summary.json
324d4ab	measure	313.5650924249785	292.63006591796875	20.935026507009752	0.048486433923244476	175024.953125	0.02892017923295498	0.0005167134804651141	0.002374766394495964	0.003089627716690302	0.007511348929256201	0.0020446795970201492	1.1640496253967285	1.1468770503997803	0.001242930069565773	1.148358702659607	1.8444244861602783	7.656167984008789	10256.916015625	31.73309326171875	0.07692703604698181	0.97900390625	25.04600715637207	0.9168635010719299	0.2723652720451355	7.618515146057223	discard	exp78_proposal_update_every_20_measure_reject	/robodata/smodak/repos/f3rm/benchmark_runs/measure/20260316_172647_measure_324d4ab/summary.json
324d4ab	measure	309.99492099904455	279.0478515625	30.947069436544552	0.025218283757567406	325990.375	0.010789738036692142	0.0003377860120963305	0.0021109466906636953	0.0025638961233198643	0.004842960275709629	0.0015847005415707827	0.5479719042778015	0.5366790294647217	0.0012138999300077558	0.5380352735519409	1.3267974853515625	7.136379241943359	10256.916015625	31.622314453125	0.07732827961444855	0.978515625	25.14293670654297	0.9174678325653076	0.27109676599502563	8.179842335581395	discard	exp79_proposal_update_every_10_measure_reject	/robodata/smodak/repos/f3rm/benchmark_runs/measure/20260316_173214_measure_324d4ab/summary.json
324d4ab	measure	218.97803083597682	198.9840850830078	19.99394575296901	0.022212505340576172	371964.4375	0.0076240901835262775	3.982003363489639e-06	0.00021130245295353234	0.0003283279947936535	0.004828689619898796	0.0015009194612503052	0.5711026191711426	0.5622801780700684	0.0006099699530750513	0.5630150437355042	1.326283574104309	6.713832855224609	12243.2236328125	31.55813217163086	0.07792793214321136	0.9794921875	25.11333656311035	0.9178839325904846	0.26883789896965027	9.018737450552676	keep	exp81_window_cache_measure_keep	/robodata/smodak/repos/f3rm/benchmark_runs/measure/20260316_174757_measure_324d4ab/summary.json
324d4ab	measure	206.24403640604578	186.2333221435547	20.010714262491092	0.021471966058015823	384880.5	0.006879311054944992	4.3664999793691095e-06	6.09384078416042e-05	0.00015285954577848315	0.0047503625974059105	0.0014946131268516183	0.5372856855392456	0.5304781198501587	0.0001177400117740035	0.5307194590568542	1.3562400341033936	6.69935417175293	6557.61865234375	30.946969985961914	0.07821917533874512	0.98046875	24.866655349731445	0.9169501662254333	0.2693258225917816	9.426177563422655	keep	exp85_images_on_gpu_gpu_feat_cache_0_measure_keep	/robodata/smodak/repos/f3rm/benchmark_runs/measure/20260316_175610_measure_324d4ab/summary.json
324d4ab	measure	205.34663412999362	188.11917114257812	17.227462987415493	0.021861398592591286	377591.65625	0.0072583467699587345	5.2123914429103024e-06	6.337088416330516e-05	0.00015960710879880935	0.004782579839229584	0.0015485620824620128	0.2461632639169693	0.2391381710767746	0.00012948899529874325	0.2393796443939209	1.3119598627090454	6.71655797958374	6557.61865234375	30.778162002563477	0.07831528037786484	0.9794921875	24.99485969543457	0.9177221059799194	0.2688280940055847	9.560625504479443	keep	exp89_cpu_feature_cache_32_measure_keep	/robodata/smodak/repos/f3rm/benchmark_runs/measure/20260316_180330_measure_324d4ab/summary.json
324d4ab	measure	199.9145467679482	185.1694793701172	14.745067397831008	0.021197641268372536	389157.8125	0.0068829855881631374	4.01844135922147e-06	6.234803731786087e-05	0.00015676654584240168	0.004637122619897127	0.001485324464738369	0.23488451540470123	0.2280218005180359	0.00010692991781979799	0.2282494157552719	1.3388168811798096	6.70983362197876	6557.61865234375	31.0068302154541	0.07846386730670929	0.97998046875	24.96373176574707	0.9174737930297852	0.2683647871017456	9.76849396625908	keep	exp91_feature_cache_hit_lazy_import_measure_keep	/robodata/smodak/repos/f3rm/benchmark_runs/measure/20260316_181613_measure_324d4ab/summary.json
324d4ab	measure	194.19017494702712	179.6956787109375	14.494496236089617	0.02069678343832493	398544.84375	0.006708917208015919	3.941025170206558e-06	6.2815539422445e-05	0.00015410596097353846	0.0045593902468681335	0.001493846415542066	0.1533401906490326	0.14659053087234497	9.816000238060951e-05	0.14679820835590363	1.3239893913269043	6.690953254699707	6557.61865234375	30.975746154785156	0.07820025086402893	0.97509765625	24.96501350402832	0.916648268699646	0.27186501026153564	9.399702815745762	keep	exp93_pin_cpu_feature_cache_off_measure_keep	/robodata/smodak/repos/f3rm/benchmark_runs/measure/20260316_182248_measure_324d4ab/summary.json
324d4ab	measure	193.13681040599477	178.95327758789062	14.18353281810414	0.02115405723452568	389861.65625	0.0069675138220191	3.8855532693560235e-06	6.514259439427406e-05	0.00016397899889852852	0.004639830905944109	0.0015307446010410786	0.13914678990840912	0.13212455809116364	0.00014625093899667263	0.13238397240638733	1.3026843070983887	6.692285537719727	6094.31884765625	30.912050247192383	0.07846806198358536	0.97705078125	24.90412712097168	0.9176921248435974	0.266234815120697	9.774362187889825	keep	exp96_foreground_uint8_label_cache_measure_keep	/robodata/smodak/repos/f3rm/benchmark_runs/measure/20260316_183125_measure_324d4ab/summary.json
324d4ab	measure	193.97400236094836	179.74537658691406	14.228625774034299	0.020698929205536842	398516.71875	0.006729571148753166	3.596954002205166e-06	6.244504766073078e-05	0.0001534970651846379	0.00453548226505518	0.0014776850584894419	0.13462749123573303	0.1278906762599945	9.690993465483189e-05	0.12810620665550232	1.33668851852417	6.669519901275635	6094.31884765625	30.846582412719727	0.07831811159849167	0.97705078125	24.817182540893555	0.9169101715087891	0.26983803510665894	9.564586293501971	discard	exp104_foreground_cpu_cache_226_measure_reject	/robodata/smodak/repos/f3rm/benchmark_runs/measure/20260316_185311_measure_324d4ab/summary.json
324d4ab	measure	194.4121891639661	180.1022491455078	14.309940018458292	0.02189994975924492	377682.0	0.007328835781663656	4.5385445446299855e-06	6.622594082728028e-05	0.00016824394697323442	0.00485672103241086	0.0015021944418549538	0.1367257833480835	0.12986041605472565	9.401992429047823e-05	0.1300666630268097	1.2964606285095215	6.584588527679443	6093.88134765625	30.84992790222168	0.07850678265094757	0.97998046875	25.14763832092285	0.9173193573951721	0.27024170756340027	9.828531189337388	discard	exp117_num_nerf_samples_23_measure_reject	/robodata/smodak/repos/f3rm/benchmark_runs/measure/20260316_191230_measure_324d4ab/summary.json
324d4ab	measure	196.01204766205046	181.61471557617188	14.397332085878588	0.021961938589811325	375761.375	0.0072769965045154095	5.287950443744194e-06	6.757394294254482e-05	0.0001714610552880913	0.005033084191381931	0.0015003415755927563	0.14011438190937042	0.13230472803115845	0.00010059005580842495	0.13251982629299164	1.3195079565048218	6.518629550933838	6093.44384765625	30.897502899169922	0.07879257202148438	0.9775390625	25.128389358520508	0.9170168042182922	0.26873379945755005	10.2283415717745	discard	exp118_num_nerf_samples_22_measure_reject	/robodata/smodak/repos/f3rm/benchmark_runs/measure/20260316_191728_measure_324d4ab/summary.json
324d4ab	measure	189.21664413891267	174.59295654296875	14.62368759594392	0.020910609513521194	392955.625	0.006906862370669842	4.284083843231201e-06	6.164699152577668e-05	0.00015499604342039675	0.004632967058569193	0.0014847340062260628	0.13616473972797394	0.1291886568069458	9.221991058439016e-05	0.1293930858373642	1.1373038291931152	4.995453357696533	6094.31884765625	31.01936912536621	0.07828681170940399	0.974609375	24.79029083251953	0.9191159605979919	0.2642413079738617	9.520798728545032	keep	exp127_proposal_samples_128_measure_keep	/robodata/smodak/repos/f3rm/benchmark_runs/measure/20260316_192659_measure_324d4ab/summary.json
